Autor,Universidad,Correo,Intereses,Cant Citas
Francisco Ganga Contreras,Universidad de Tarapacá,Dirección de correo verificada de academicos.uta.cl,Educación superior gobernanza universitaria gobierno universitario talento humano liderazgo ,Citado por 3192
Liliana Pedraja Rejas,Profesora Titular Universidad de Tarapaca,Dirección de correo verificada de uta.cl,liderazgo educación superior estrategia. ,Citado por 3062
David Laroze,"Professor of Physics, Universidad de Tarapacá",Dirección de correo verificada de uta.cl,Chaos Hydrodynamic Instabilities Magnetism Quantum mechanics Mathematical modeling ,Citado por 2235
Sergio gonzález Miranda,"Universidad de Tarapacá, profesor titular",Dirección de correo verificada de academicos.uta.cl,historia regional relaciones internacionales historia de la minería ,Citado por 1751
Marco Esteban Rivera Abarca,"Full Professor, Department of Electrical Engineering, Universidad de Talca",Dirección de correo verificada de utalca.cl,Matrix Converters Power Electronics Power Converters AC AC Converters Predictive Control ,Citado por 8129
M. Fernandez Fernandez,Universidad de Talca,Dirección de correo verificada de utalca.cl,Automatización Control de Procesos Electrónica Mecatrónica ,Citado por 6037
Ivan Palomo,Universidad de Talca,Dirección de correo verificada de utalca.cl,,Citado por 4847
Leonardo Silva Santos,"Full Professor (Profesor Titular), Instituto de Química de Recursos Naturales, Universidad de …",Dirección de correo verificada de utalca.cl,Chemistry ,Citado por 4733
Julio Caballero,Universidad de Talca,Dirección de correo verificada de utalca.cl,molecular modeling bioinformatics nanoscience protein kinases ion channels ,Citado por 4548
Humberto Nogueira Alcalá,Universidad de Talca,Dirección de correo verificada de utalca.cl,,Citado por 4323
Renzo Angles,"Department of Computer Science, Universidad de Talca ",Dirección de correo verificada de utalca.cl,Graph databases Query Languages RDF SPARQL ,Citado por 3967
Manuel Cárdenas Castro,Universidad de Talca,Dirección de correo verificada de utalca.cl,Psicología social ,Citado por 3046
Sergei Trofimchuk,Universidad de Talca,Dirección de correo verificada de inst-mat.utalca.cl,Differential equations difference equations dynamical systems ,Citado por 2720
Narciso Cerpa,"Faculty of Engineering, Universidad de Talca",Dirección de correo verificada de utalca.cl,Software Engineering Electronic Commerce ,Citado por 2658
Juan C Saez,"Instituto de Neurociencias, Universidad de Valparaíso, Valparaíso, Chile (juancarlos.saez …",Dirección de correo verificada de uv.cl,… and pannexin channels in physiology and … ,Citado por 19064
Amelia Bayo,"Full professor, Universidad de Valparaíso; Director, Millennium Nucleus for Planet …",Dirección de correo verificada de uv.cl,star and substellar planet formation federated data and machine learning observational techniques and instrumentation ,Citado por 7191
Marie Therese Flores,"Professor Pediatric Dentistry, Faculty of Dentistry, Universidad de Valparaiso",Dirección de correo verificada de uv.cl,dental traumatology child behavior management ,Citado por 6895
Wael El-Deredy,"Universidad de Valparaiso, Chile",Dirección de correo verificada de UV.CL,Cognitive Electrophysiology Neuroimaging Bayesian inference Brain Dynamics Reward processing ,Citado por 5117
John Ewer,"CINV, Universidad de Valparaiso, CHILE",Dirección de correo verificada de uv.cl,,Citado por 4305
Agustin D Martinez,"Centro Interdisciplinario de Neurociencia de Valparaíso, Universidad de Valparaíso",Dirección de correo verificada de uv.cl,connexin pannexin ,Citado por 3565
Carlos Gonzalez Leon,Universidad de Valparaiso,Dirección de correo verificada de uv.cl,Ion Channel Biophysics ,Citado por 3313
Adrian G Palacios,Universidad de Valparaiso,Dirección de correo verificada de uv.cl,Sensory Biology Computational Neuroscience Ecology ,Citado por 3232
Adrian G Palacios,Professor Universidad de Valparaiso,Dirección de correo verificada de uv.cl,Sensory Biology Computational Neuroscience ,Citado por 3213
Yara L Jaffe,Universidad de Valparaiso,Dirección de correo verificada de uv.cl,Extragalactic Astronomy Galaxy evolution ,Citado por 2659
