Autor,Universidad,Correo,Intereses,Cant Citas
Patricio De los Rios-Escalante [or Patricio De los Ríos],"Profesor Asistente, Universidad Catolica de Temuco",Dirección de correo verificada de uct.cl,Ecología acuática crustáceos / Aquatic Ecology crustaceans ,Citado por 1622
David Tempo,"Universidad Católica de Temuco (UCT), Temuco, Chile",Dirección de correo verificada de uct.cl,General Relativity Spacetime symmetries Black hole physics ,Citado por 1590
Fernando A. Peña Cortés,"Profesor Titular, Laboratorio de Planificación Territorial. Universidad Católica de Temuco",Dirección de correo verificada de uct.cl,geografía física planificación territorial educación geográfica ,Citado por 1502
Angélica Casanova-Katny,Universidad Católica de Temuco,Dirección de correo verificada de uct.cl,global climate change global warming antarctic plants moss lichens ,Citado por 1292
segundo quintriqueo millan,Universidad Católica de Temuco,Dirección de correo verificada de uct.cl,Educación interculturalidad saberes indígenas investigación en educación ,Citado por 1149
Elias Gustavo Figueroa Villalobos,Universidad Católica de Temuco,Dirección de correo verificada de uct.cl,Aquaculture ,Citado por 1122
Daniel San Martín Cantero,Universidad Católica de Temuco,Dirección de correo verificada de uct.cl,Teoría Fundamentada Socio-fenomenología Metodología Cualitativa Profesores principiantes vida cotidiana ,Citado por 889
Felipe Caamaño,Profesor de educación física en Universidad Católica de Temuco,Dirección de correo verificada de educa.uct.cl,Obesidad ejercicio fisiología variables Psicosociales ,Citado por 816
Pablo Letelier,"Precision Health Research Laboratory, Departamento de Procesos Diagnósticos y …",Dirección de correo verificada de uct.cl,epigenetics oncology ,Citado por 791
Lohengrin Cavieres,Universidad de Concepcion,Dirección de correo verificada de udec.cl,Plant Ecology Plant ecophysiology Alpine Plant Ecology ,Citado por 13566
Osvaldo Ulloa,"Universidad de Concepción, Chile",Dirección de correo verificada de udec.cl,Microbial Oceanography ,Citado por 12190
ruben pena,"university of nottingham, university of magallanes, university of concepcion",Dirección de correo verificada de udec.cl,power electronics ac drives renewable energy ,Citado por 10701
José R. Espinoza,"Professor, Electrical Engineering Department, Universidad de Concepción",Dirección de correo verificada de udec.cl,Modelling and Control of Static Power … ,Citado por 10127
Aníbal Pauchard,Universidad de Concepción,Dirección de correo verificada de udec.cl,Invasion Ecology ,Citado por 9919
Rodrigo Reeves,"Associate Professor, CePIA, Astronomy Department, Universidad de Concepción, Chile",Dirección de correo verificada de udec.cl,Radio astronomy AGN blazar variability polarimetry mm and submm-wave instrumentation cryogenic instruments ,Citado por 9763
Luis Morán,Concepcion University,Dirección de correo verificada de udec.cl,Power Quality Power Electronics Power System Protections ,Citado por 9708
Sergio N. Torres,"Professor of Electrical Engineering, University of Concepcion",Dirección de correo verificada de udec.cl,Optoelectronics Infrared Imaging Hyperspectral Imaging interferometry ,Citado por 9198
Roberto Rodriguez Rios,"Profesor Emérito, Universidad de Concepción",Dirección de correo verificada de udec.cl,Botánica Flora de Chile ,Citado por 8802
Michael Fellhauer,"associate professor of astronomy, Universidad de Concepcion, Concepcion, Chile",Dirección de correo verificada de astro-udec.cl,astronomy: theoretical stellar dynamics ,Citado por 8623
Jose L. Prieto,Universidad Diego Portales,Dirección de correo verificada de mail.udp.cl,Astronomy ,Citado por 22591
Jose Joaquin BRUNNER,"Professor,  Sociology of Education. UNESCO Chair, Universidad Diego Portales, Chile",Dirección de correo verificada de mail.udp.cl,Higher education Political economy of education Policy and cultural analysis ,Citado por 19150
PAULA JOFRE PFEIL,assistant professor Nucleo Astronomia Universidad Diego Portales,Dirección de correo verificada de mail.udp.cl,stellar and Galactic astrophysics ,Citado por 11508
Cristóbal Rovira Kaltwasser,"Professor, Universidad Diego Portales",Dirección de correo verificada de udp.cl,comparative politics populism democracy ,Citado por 10503
ROBERTO J. ASSEF,Universidad Diego Portales,Dirección de correo verificada de mail.udp.cl,Active Galactic Nuclei Galaxy Evolution ,Citado por 9481
fernando zegers-hochschild,Emeritus professor University Diego Portales and Clinica las Condes,Dirección de correo verificada de udp.cl,reproductive medicine ,Citado por 9478
JORGE IGNACIO GONZÁLEZ LÓPEZ,Universidad Diego Portales,Dirección de correo verificada de mail.udp.cl,Galaxy evolution Interstellar medium high redshift galaxies and data science ,Citado por 9256
Manuel Aravena,"Professor of Astrophysics, Universidad Diego Portales",Dirección de correo verificada de mail.udp.cl,Galaxy formation Galaxy evolution Submillimeter galaxies ISM of galaxies ,Citado por 9050
LUCAS CIEZA,Universidad Diego Portales,Dirección de correo verificada de mail.udp.cl,Astronomy ,Citado por 8986
Alice Zurlo,Universidad Diego Portales,Dirección de correo verificada de mail.udp.cl,Exoplanets ,Citado por 5554
Will Brooks,Universidad Técnica Federico Santa Maria,Dirección de correo verificada de usm.cl,High Energy and Nuclear Physics ,Citado por 183014
Raquel Pezoa,Universidad Técnica Federico Santa María,Dirección de correo verificada de usm.cl,artificial intelligence machine learning computer vision image processing ,Citado por 148996
Samir Kouro,Universidad Técnica Federico Santa María,Dirección de correo verificada de usm.cl,Power Electronics Renewable Energy Multilevel Converters Wind Energy Electromobility ,Citado por 25218
Patricio Cortes,"Universidad Tecnica Federico Santa Maria, Chile",Dirección de correo verificada de usm.cl,Power Electronics Predictive Control ,Citado por 14163
Marcelo A. Perez,Universidad Tecnica Federico Santa Maria,Dirección de correo verificada de usm.cl,Power electronics multilevel converters smart grids ,Citado por 13999
Ahmed El Alaoui,Universidad Tecnica Federico Santa Maria,Dirección de correo verificada de usm.cl,Non-perturbative QCD Hadronization Nuclear medium effect Spin Physics Nucleon Structure ,Citado por 10544
Cesar Silva,"Departamento de Electrónica, Universidad Técnica Federico Santa María, Chile",Dirección de correo verificada de usm.cl,AC motor drives digital control of power converters ,Citado por 8020
Pablo Lezana,Universidad Técnica Federico Santa Maria,Dirección de correo verificada de usm.cl,,Citado por 6938
Marcelo Mendoza,"Associate Professor, Universidad Técnica Federico Santa María, CCTVAL and IMFD",Dirección de correo verificada de usm.cl,Online social networks information retrieval sentiment analysis clustering web mining ,Citado por 6433
Michael Seeger,Universidad Tecnica Federico Santa Maria,Dirección de correo verificada de usm.cl,microbiology botechnology ,Citado por 5024
Médéric Boquien,Universidad de Antofagasta,Dirección de correo verificada de uantof.cl,Galaxy evolution ,Citado por 17006
Miguel Avendaño Díaz,"Profesor de Acuicultura, Universidad de Antofagasta; Chile",Dirección de correo verificada de uantof.cl,manejo y cultivo de moluscos ,Citado por 11741
Christian HR Nitschelm,"Full professor, Centro de Astronomía (CITEVA), Universidad de Antofagasta, Chile",Dirección de correo verificada de uantof.cl,Astronomy and astrophysics ,Citado por 6357
Javier Alonso-García,"Unidad de Astronomía, Universidad de Antofagasta",Dirección de correo verificada de uantof.cl,,Citado por 5138
Patricio Morales,University of Antofagasta,Dirección de correo verificada de uantof.cl,reproductive biology ,Citado por 3594
Carlos Riquelme,Universidad de Antofagasta Chile,Dirección de correo verificada de uantof.cl,marine microbiology interaction Bacteria-microalga probiotics aquaculture ,Citado por 2958
Benito Gomez-Silva,"Universidad de Antofagasta, Chile",Dirección de correo verificada de uantof.cl,Microbiology of the Atacama Desert. ,Citado por 2742
Luis Cisternas,Universidad de Antofagasta,Dirección de correo verificada de uantof.cl,optimization mineral processing process design cleaner production lithium processing ,Citado por 2605
Marcelo E Oliva,Universidad de Antofagasta Instituto Ciencias Naturales Alexander von Humboldt,Dirección de correo verificada de uantof.cl,Parasitologia marina ecologia evolucion ,Citado por 2419
"Jorge Enrique Araya, Araya JE",Profesor de Parasitología y Biología Molecular. Universidad de Antofagasta - CHILE,Dirección de correo verificada de uantof.cl,Biología Molecular de Microorganismos ,Citado por 2235
Francisco Sabatini,"Profesor titular, Universidad del Bio Bio, Chile; profesor titular adjunto, U. Católica de Chile",Dirección de correo verificada de ubiobio.cl,Planificación urbana sociologia urbana ,Citado por 6343
María Margarita Chiang Vega,"Doctora en Recursos Humanos, Universidad del Bio Bio, Chile",Dirección de correo verificada de ubiobio.cl,Comportamiento organizacional Gestión de Recursos Humanos ,Citado por 4232
Elizabeth Eliana Grandón Toledo,Universidad del Bio-Bio,Dirección de correo verificada de ubiobio.cl,technology adoption information systems electronic commerce ,Citado por 3696
Carlos Alonso Escudero Orozco,Universidad del Bio Bio,Dirección de correo verificada de ubiobio.cl,Biomedicina preeclampsia angiogenesis ,Citado por 2532
Gipsy Tabilo-Munizaga,Universidad del Bío-Bío,Dirección de correo verificada de ubiobio.cl,food science ,Citado por 2269
José Norambuena-Contreras,Associate Professor in Civil Eng. Materials - University of Bío-Bío,Dirección de correo verificada de ubiobio.cl,Bituminous Materials Self-Healing Materials Waste Materials Innovative Materials ,Citado por 2209
Julio Alarcon,Universidad del Bio-Bio,Dirección de correo verificada de ubiobio.cl,Química de Productos Naturales ,Citado por 2070
Ricardo Darío Villalobos Carvajal,Universidad del Bío-Bío- Food Engineering Department,Dirección de correo verificada de ubiobio.cl,,Citado por 1854
Carlos Torres Navarro,Universidad del Bío-Bío,Dirección de correo verificada de ubiobio.cl,Calidad Producción ,Citado por 1662
David Mora,"Universidad del Bío-Bío, Concepción, Chile",Dirección de correo verificada de ubiobio.cl,numerical analysis of PDEs finite element method virtual element discretizations ,Citado por 1363
Humberto Maturana,Universidad de Chile,Dirección de correo verificada de dcc.uchile.cl,Neurobiology Cognition Autopoiesis Language Education ,Citado por 90115
Sergio  Lavandero,"Professor & Director ACDDiS, University of Chile, Adjunct Prof., UT Southwestern Medical …",Dirección de correo verificada de uchile.cl,Cell Signaling Cardiovascular Diseases ,Citado por 28839
Alfredo Guillermo Criollo,Laboratory of Cellular and Molecular Biology Research Institute of Dental Science  Faculty …,Dirección de correo verificada de u.uchile.cl,Cellular Biology Cancer ,Citado por 28431
Mario Hamuy,"Profesor de Astronomía, Universidad de Chile",Dirección de correo verificada de u.uchile.cl,,Citado por 27719
Gonzalo Navarro,University of Chile,Dirección de correo verificada de dcc.uchile.cl,algorithms and data structures text searching compression similarity search ,Citado por 27037
José De Gregorio,Profesor de Economía Universidad de Chile,Dirección de correo verificada de fen.uchile.cl,Macroeconomics International Economics International Finance Economic Development ,Citado por 24181
Juan Segura Aguilar,"Professor, Molecular & Clinical Pharmacologt, Faculty of Medicine, University of Chile",Dirección de correo verificada de med.uchile.cl,neuroscience toxicology biochemistry molecular biology stem cells ,Citado por 18729
Lorena García Nannig,Universidad de Chile,Dirección de correo verificada de ciq.uchile.cl,Cardiovascular Disease Inflammation ,Citado por 16991
René Darío Garreaud,"Professor, Geophysics Department, Universidad de Chile",Dirección de correo verificada de uchile.cl,Atmospheric Sciences ,Citado por 15826
Mary TK Arroyo,Universidad de Chile,Dirección de correo verificada de uchile.cl,Alpine ecology pollination biogeography conservation ,Citado por 15176
Sergio Munoz,Universidad de La Frontera,Dirección de correo verificada de ufrontera.cl,Estudios poblacionales desigualdades en salud metodologia de investigacion medicion en salud ,Citado por 11779
Pamela SERON SILVA,Universidad de La Frontera,Dirección de correo verificada de ufrontera.cl,Exercise Cardiovascuar Conditions Rehabilitation ,Citado por 6731
Tamara Otzen,Universidad de La Frontera,Dirección de correo verificada de ufrontera.cl,Suicidio Revisiones Sistemáticas de la Literatura Estadística Metodología de investigación ,Citado por 6669
Fernando Borie,Universidad de La Frontera,Dirección de correo verificada de ufrontera.cl,mycorrhiza soil phosphorous glomalin ,Citado por 6542
Carlos Felimer del Valle Rojas,Universidad de La Frontera (UFRO,Dirección de correo verificada de ufro.cl,Discurso comunicación interculturalidad educación ,Citado por 5882
David Jeison,"Department of Chemical Engineering, Universidad de La Frontera",Dirección de correo verificada de ufrontera.cl,environmental biotechnology ,Citado por 5021
"MC Diez, Diez, MC, Maria Cristina Diez","profesor de Ciencias Ambientales, Universidad de La Frontera",Dirección de correo verificada de ufrontera.cl,biotecnologia ambiental ,Citado por 4813
Raúl Sánchez,Universidad de La Frontera,Dirección de correo verificada de ufrontera.cl,Biologia de la reproduccion Andrologia Medicina reproductiva ,Citado por 4539
Milko A. Jorquera,"Scientific and Technological Bioresource Nucleus (BIOREN), Universidad de La Frontera …",Dirección de correo verificada de ufrontera.cl,Microbiology and Biotechnology ,Citado por 4266
"""pablo cornejo"", ""P. Cornejo"", ""Cornejo, P."", ""Cornejo P.""","""Universidad de La Frontera"", ""Estacion Experimental del Zaidin""",Dirección de correo verificada de ufrontera.cl,Arbuscular mycorrhizal fungi soil bioremediation ,Citado por 3765
Alejandro H. Buschmann,"Centro i-mar, Universidad de Los Lagos",Dirección de correo verificada de ulagos.cl,Seaweed Ecology and Aquaculture Sustainable Aquaculture Integrated Multi-Trophic Aquaculture ,Citado por 13183
Cristian Alvarez,Universidad de Los Lagos,Dirección de correo verificada de ulagos.cl,Actividad fisica Entrenamiento Insulino Resistencia Diabetes tipo 2 Hipertensión ,Citado por 3753
Cecilia Smith-Ramirez,"Profesor Titular, Departamento de Ciencias Biológicas y Biodiversidad, Universidad de Los …",Dirección de correo verificada de ulagos.cl,Conservación biológica mutualismos planta-animal especies invasoras restauración ecológica ,Citado por 3516
Ricardo Fernandez,Universidad de Los Lagos,Dirección de correo verificada de ulagos.cl,Systemic inflammation Air pollution ,Citado por 2498
Luis Roberto Pino-Fan,Universidad de Los Lagos,Dirección de correo verificada de ulagos.cl,Formación de Profesores Conocimiento del Profesor Didáctica de la Matemática Mathematics Education Educación Matemática ,Citado por 1836
Edwin J. Niklitschek,"Centro i~mar, Universidad de Los Lagos",Dirección de correo verificada de ulagos.cl,Ecología de poblaciones marinas ,Citado por 1154
Paulina Helena Gebauer Mery,Centro I-mar. Universidad de Lagos. Chile,Dirección de correo verificada de ulagos.cl,population biology marine larval ecology marine invertebrate ,Citado por 1119
Ricardo Fernández Acevedo,"Profesor Asociado A, Universidad de Los Lagos",Dirección de correo verificada de ulagos.cl,Control neural de la inflamación sistémica … ,Citado por 1068
Alex L. Véliz Burgos,Universidad de Los Lagos,Dirección de correo verificada de ulagos.cl,Salud y bienestar colectivo ,Citado por 943
Carolina Camus Torres,"Researcher, Centro i-mar, Universidad de Los Lagos",Dirección de correo verificada de ulagos.cl,Phycology ,Citado por 867
Alexandre Roman-Lopes,Universidad de La Serena,Dirección de correo verificada de userena.cl,Astrophysics: Massive Stars Star-Formation Regions The Galaxy ,Citado por 8593
Alexandre Roman Lopes,Universidad de La Serena - Departamento de Astronomía,Dirección de correo verificada de userena.cl,Astronomy ,Citado por 8555
Ernesto Gianoli,"Professor, Universidad de La Serena, Chile",Dirección de correo verificada de userena.cl,Ecology and Evolution ,Citado por 7276
Ricardo Amorin,"Universidad de La Serena, Astronomy Department",Dirección de correo verificada de userena.cl,Observational Astrophysics Extragalactic Astronomy Galaxy Formation and Evolution Star-forming Galaxies ,Citado por 6763
Rodolfo Barbá,"Astronomer, Universidad de La Serena",Dirección de correo verificada de userena.cl,Astronomy Astrophysics Massive Stars Binary Stars Star Formation ,Citado por 6644
Julio Roberto Gutierrez Camus,"Profesor Titular, Universidad de La Serena",Dirección de correo verificada de userena.cl,Ecología ,Citado por 6474
Javier Eduardo Silva Espejo,Universidad de La Serena,Dirección de correo verificada de userena.cl,Ecología ,Citado por 6159
juan carlos helo,"Universidad de La Serena, La Serena, Chile.",Dirección de correo verificada de userena.cl,particle physics phenomenology. ,Citado por 3112
José Luis Nilo Castellón,Universidad de La Serena,Dirección de correo verificada de userena.cl,Astronomia experimental. Astronomia … ,Citado por 2901
Claudia Elizabeth Barraza Zepeda,"Academico Media Jornada, Depto de Biología Facultad de Ciencias Universidad de la …",Dirección de correo verificada de userena.cl,microbiologia clínica educación en ciencias de la salud epidemiología inmunología ,Citado por 1264
Juan Carlos Aravena,Universidad de Magallanes,Dirección de correo verificada de umag.cl,dendrochronology climate glacial geomorphology ,Citado por 4159
Jorge Carrasco,Universidad de Magallanes - Centro de Investigación Gaia Antártica,Dirección de correo verificada de umag.cl,atmospheric sciences cryosphere Antarctic meteorology and climatology Synoptic meteorology and forecasting ,Citado por 4118
Ricardo De Pol-Holz,"Centro de Investigación GAIA-Antártica (CIGA), Universidad de Magallanes",Dirección de correo verificada de umag.cl,Oceanography Quaternary Science Paleoceanography Paleoclimatology Radiocarbon ,Citado por 2839
alfredo prieto,Universidad de Magallanes,Dirección de correo verificada de umag.cl,archaeology hunter-gatherers ethnography ancient DNA ,Citado por 2485
Rodrigo Villa Martinez,Universidad de Magallanes,Dirección de correo verificada de umag.cl,paleoclima palinología biogeografia botanica ,Citado por 2235
Andrés Mansilla M.,Universidad de Magallanes,Dirección de correo verificada de umag.cl,Ficologia subantártica y antártica ,Citado por 2064
Yolanda Espinosa-Parrilla,Universidad de Magallanes,Dirección de correo verificada de umag.cl,Ageing Gastric Cancer Neurodegenerative Disorders Human evolution non-protein codign RNAs ,Citado por 1826
Flavia Morello,Universidad de Magallanes - Instituto de la Patagonia,Dirección de correo verificada de umag.cl,Ciencias Sociales - Arqueología - Patrimonio ,Citado por 1389
Elke Schüttler,"Investigator, Sub-antarctic Biocultural Conservation Program, Universidad de Magallanes …",Dirección de correo verificada de umag.cl,biological conservation biological invasions population ecology ethnoecology mammals ,Citado por 1206
Máximo Frangopulos Rivera,Universidad de Magallanes,Dirección de correo verificada de umag.cl,Oceanografía Biológica Floraciones de Algas Nocivas Mareas Rojas Conservación ,Citado por 1038
Ricardo Tejos Ulloa,"Facultad de Recursos Naturales Renovables, Universidad Arturo Prat",Dirección de correo verificada de unap.cl,Plant Cell Biology Arabidopsis Intracellular trafficking Abiotic stress ,Citado por 1963
Cristina Quispe,Universidad Arturo Prat,Dirección de correo verificada de unap.cl,Productos naturales ,Citado por 1317
Julio Benites,Profesor Titular de la Universidad Arturo Prat,Dirección de correo verificada de unap.cl,Química Orgánica ,Citado por 1289
Karina Beatriz Ruiz Carrasco,Universidad Arturo Prat,Dirección de correo verificada de unap.cl,Plant Science Plant physiology Abiotic stresses ,Citado por 1178
Cristobal Corral,"Universidad Arturo Prat, Instituto de Ciencias Exactas y Naturales, Facultad de Ciencias",Dirección de correo verificada de unap.cl,Gravitation and Field theory ,Citado por 965
Gabriel Claramunt,Universidad Arturo Prat,Dirección de correo verificada de unap.cl,Evaluación de poblaciones biología reproductiva ,Citado por 798
Jose Delatorre-Herrera,Universidad Arturo Prat,Dirección de correo verificada de unap.cl,Plant physiology plant nutrition stress salinity photosynthesys ,Citado por 778
Erico R. Carmona,"Academic, Universidad Arturo Prat, Chile",Dirección de correo verificada de unap.cl,nanomaterials nanotoxicology genetic toxicology ecotoxicology ,Citado por 776
Gabriela Aguirre Martinez,Universidad Arturo Prat,Dirección de correo verificada de unap.cl,Ecotoxicología contaminantes emergentes biomarcadores biensayos ,Citado por 745
Rosalino Fuenzalida,"Profesor de Oceanografía, Universidad Arturo Prat",Dirección de correo verificada de unap.cl,Circulación Masas de Agua ENSO Cambio Climático Medio Ambiente ,Citado por 678
Jose Alejandro Gonzalez Campos,Universidad de Playa Ancha,Dirección de correo verificada de upla.cl,Estadística Aplicada a la Educación y … ,Citado por 1410
Verónica Molina T.,Universidad de Playa Ancha,Dirección de correo verificada de upla.cl,Ecologia Microbiana Biogeoquimica Oceanografia Microbiana ,Citado por 1304
Jean-Pierre Francois,"Departamento de Ciencias Geográficas, Universidad de Playa Ancha",Dirección de correo verificada de upla.cl,Geografía Ambiental Ecología del Paisaje Paleoecología Palinología ,Citado por 1290
Roberto Orellana,Universidad de Playa Ancha,Dirección de correo verificada de upla.cl,Environmental Microbiology ,Citado por 1121
Paulina Bahamonde,HUB Ambiental - Universidad de Playa Ancha,Dirección de correo verificada de upla.cl,ecotoxicology ,Citado por 810
paula pavez,Universidad de Playa Ancha,Dirección de correo verificada de upla.cl,psicología emociones agresión y cooperación en seres humanos ,Citado por 799
Miguel R. Guevara,"Cs. Department, Universidad de Playa Ancha",Dirección de correo verificada de upla.cl,web mining data science scientometrics online social networks ,Citado por 724
Claudio A. Sáez,Universidad de Playa Ancha,Dirección de correo verificada de upla.cl,ecotoxicology environmental biotechnology Climate Change ecology phycology ,Citado por 700
Franklin Johnson Parejas,Universidad de Playa Ancha,Dirección de correo verificada de upla.cl,Optimization Constraint Programming Metaheuristics ,Citado por 696
Alejandro Martín Madrid Villegas,"Academico, Departamento de Química, Universidad de Playa Ancha",Dirección de correo verificada de upla.cl,Productos Naturales y Síntesis Organica ,Citado por 677
José H Zagal  FRSC,"Distinguished Professor, Director, Laboratory of Electrocatalysis, University of Santiago de …",Dirección de correo verificada de usach.cl,electrochemistry electrocatalysis molecular electrochemistry fuel cells sensors ,Citado por 9703
Yenniffer Ávalos,"Assistant Professor, Universidad de Santiago de Chile",Dirección de correo verificada de usach.cl,Autophagy primary cilium insulin signaling obesity high-fat diet ,Citado por 8822
Cristóbal M. Espinoza,Universidad de Santiago de Chile,Dirección de correo verificada de usach.cl,Pulsar astronomy Space physics ,Citado por 6068
Francisco Melo,Departamento de Física Universidad de Santiago,Dirección de correo verificada de usach.cl,soft matter ,Citado por 5933
Claudio Martinez,Universidad de Santiago de Chile (USACH),Dirección de correo verificada de usach.cl,Genetics Microbiology Biotechnology ,Citado por 5542
Mikhail Plyushchay,Universidad de Santiago de Chile,Dirección de correo verificada de usach.cl,Theoretical Physics Mathematical Physics Symmetries ,Citado por 5332
Maria Galotto,Universidad de Santiago de Chile,Dirección de correo verificada de usach.cl,Food Packaging and Technology ,Citado por 4414
Juan Silva Quiroz,"Académico Departamento de Educación y Director de CIIET, Universidad de Santiago de …",Dirección de correo verificada de usach.cl,e-learning competencias digitales Tutoría Online Diseño Instruccional Online Competencia Digital Docente ,Citado por 4355
Lucia Dammert,Universidad de Santiago de Chile,Dirección de correo verificada de usach.cl,crime latin america ,Citado por 3984
Dinesh Pratap Singh,"Department of Physics, University of Santiago, Chile (https://fisica.usach.cl/es)",Dirección de correo verificada de usach.cl,Synthesis of nanomaterials Graphene based supercapacitors and  solar … Nanotribology Nanomedicine Nano-optics ,Citado por 3936
Bernardo Arriaza,Universidad de Tarapacá,Dirección de correo verificada de uta.cl,Chinchorro mummies Bioarchaeology Paleopathology ,Citado por 6153
Alejandra Caqueo-Urízar,Universidad de Tarapacá,Dirección de correo verificada de uta.cl,Psicología Clínica ,Citado por 5609
Calogero M. Santoro,Universidad de Tarapaca,Dirección de correo verificada de uta.cl,Archaeology hunter-gatherers paleoenviroment South America Andes ,Citado por 5184
Bárbara Rojas-Ayala,"Astronomer, Instituto de Alta Investigación, Universidad de Tarapacá",Dirección de correo verificada de uta.cl,Low Mass Stars Brown dwarfs Exoplanets ,Citado por 4611
Heriberto Román Flores,Universidad de Tarapacá,Dirección de correo verificada de uta.cl,,Citado por 3615
Emilio Rodríguez Ponce,Profesor Titular - Universidad de Tarapacá (Chile),Dirección de correo verificada de uta.cl,Educación Superior Gestión del Conocimiento Liderazgo ,Citado por 3363
